06931bc1-5427-48c5-a725-8cd2b890f43f,06/03/23,"Payday loan, title loan, or personal loan",Installment loan,Charged fees or interest you didn't expect,None,"On XX/XX/2022 we bought tile from the XXXX XXXX in XXXX, XXXX. using the 0 % financing that they offered. Several months later we found out this program was through Comenity Bank. We believe Comenity Bank acted fraudulently in this matter causing me many, many hours on the phone with customer service reps apparently reading scripts, much duress, damage to my credit score, negative financial impact on my resources, and the problem is still continuing. 
When we opened this account at the store we were told we would receive documentation concerning this financing, account information etc. in the mail. During the months of XXXX, XXXX and XXXX we called the store XXXX times, we were concerned because we hadn't received paperwork or a bill. We were told they looked into it, everything was normal and we should be receiving it. It should also be noted that during this period I received several ( XXXX or XXXX ) phone calls from a restricted number, which I didn't answer. I only know XXXX person who calls on a restricted number which I don't answer but he will leave a message. This is where the scam on XXXX 's part begins. On XXXX XXXX, I received a call from a restricted number, this time they left a message. It was concerning my delinquent account and I was to contact them so they could help me with it. Interesting that no messages were left until my account was delinquent, interest and fees had kicked in. As shown in my credit report the account was shown XXXX for XXXX and XXXX, and then XXXX for XXXX. Not knowing if this was a legitimate call we went to the store on XXXX XXXX. 
The XXXX said there was nothing he could do, we were on our own with the bank. We spent an hour and a half on the phone while in the store, and gave up, deciding to resume call on the way home. After hours of listening to a customer service rep reading scripts and telling me nothing they could do, I was put through to a XXXX, XXXX, XXXX. She repeatedly said basically the same things. They knew the bills and paperwork were going to the wrong address ( they were being returned to them ). they contacted me XXXX times ( the calls on a restricted number with no message ) but she didn't know how the phone system worked. They could have emailed, left a message, or contacted the XXXX XXXX which they didn't. I wanted to get a statement right away so I wouldn't be late with this months payment, but she said they couldn't do that and we would be delinquent again building up more fees and interest and further damage to my credit score. We were then basically bullied into paying {$570.00} immediately, which we did, and without being able to see a statement. We had to give payment information to her because at this point we still didn't know our account number so couldn't pay online. 
On XXXX XXXX I called customer service, ( XXXX? ) wanted to get a statement right away so I wouldn't be late again and to see what was included in my pmt of {$570.00}. She said she couldn't do that until Mon and it would emailed it to me. Also I was again told they couldn't give me my account number so I could view my account online. I would find out my account number when I received my card in about XXXX days. I did not receive an email with the requested statement. I will say that on that first payment XXXX was able to subtract the fee and interest, but now with the statement I just received, we are now back to adding interest, and this will mean many more hours of stress on the phone and watching my XXXX XXXX drop. We have acted in good faith throughout this horrific experience, my XXXX XXXX has been irreparably damaged ( including financial as it affects such random things as insurance rates, loan rates etc ) and my previously near perfect credit score reflects, I have always and also in this matter acted responsibly in financial matters. I believe Comenity intentionally made unidentified ( restricted ) calls with no message until they could assess penalties and then they could say repeatedly "" we contacted you XXXX times ''. Also they were aware I was not receiving the bills. They made no attempt to help. There are no documents to attach except my damaged credit report, it started at XXXX before this, but they do have recorded phone calls which will substantiate all of this.",None,"Bread Financial Holdings, Inc.",MA,023XX,Older American,Consent provided,Web,06/03/23,Closed with monetary relief,Yes,N/A,7068787,570.0,-0.95,9,120,15,Predatory Billing / Hidden Interest,Phone,ACH / Phone Payment,Coercive Collection|Poor Customer Service|Mishandled Documentation,Credit Score Damage|Financial Stress,,Fair Credit Reporting Act Violation|UDAAP,,Comenity Bank
04a6ad92-4cda-4c80-8caa-c8b2b336eb28,03/18/25,Credit card,General-purpose credit card or charge card,"Advertising and marketing, including promotional offers",Didn't receive advertised or promotional terms,"Took advantage of XXXX promotion twice with required paid in full in XX/XX/year>2025 and XX/XX/year>2025. Payments were made every month with my schedule that both would be paid by closure dates. What was being done even after numerous phone calls to citibank would put my payments towards the XXXX promotion. Doing this would cause the XXXX promotion never to be paid off on time. I instructed Citibank numerous time to pay the XXXX first. They refused. Call to direct them to pay the XXXX promotion in full as I sent enough to pay it in full, none of the money went to pay off the XXXX promotion SCAM. Now I must pay interest due to Citibank refusing to pay off as requested.",Company has responded to the consumer and the CFPB and chooses not to provide a public response,"CITIBANK, N.A.",MA,019XX,"Older American, Servicemember",Consent provided,Web,03/18/25,Closed with explanation,Yes,N/A,12542711,0.0,-0.7,6,60,4,Payment Misallocation,Phone,Monthly Payments,Failure to Follow Instructions|Refusal to Correct Error,Unnecessary Interest Charges,,CARD Act Violation,,Citibank
3c6d54fb-a3e4-43b0-a2fb-a2a02f9b3565,08/09/21,Credit card or prepaid card,Store credit card,Problem with a credit reporting company's investigation into an existing problem,Problem with personal statement of dispute,"In XXXX, I signed up for a store credit card at XXXX. The card was administered through Comenity Bank. I made an initial big purchase of {$250.00} and paid it off in full on the Comenity website. I then charged {$59.00} to the card and was under the impression that I had set up the card to pay automatically. When the account became past due, I did receive calls from Comenity, but I thought they were spam. This is the reason I am writing to you today. I do not dispute the fact that I incorrectly assumed the card was set up for auto pay. I DO maintain that Comenity should have called me from a phone number associated with the bank and provided me with more information about what was going on when they left messages. The phone messages that were left for me said, Im calling in regards to an issue wit
h your Comenity credit card. No other information was mentioned not the name of the store or any other identifying information. When I googled the phone numbers from which the calls were coming, they werent associated with Comenity as a company. I then googled Comenity collections scams and found a lot of language on the internet about a scam around a Victorias Secret credit card ( which I used to use, but closed out years ago. ) I get spam calls every day and have participated in mandatory scamming training for my employer. All of the advice says not to trust someone calling you from a number not associated with the bank itself. Therefore, I assumed all of this was a scam until I finally saw my FICO score dip. When I checked on my credit report, I saw the card and immediately paid it off in full. 

I regularly carry balances of thousands of dollars on my credit cards and I always pay them off in full each month, usually utilizing automatic payments. This is the first time that Ive ever had something like this happen to me, and the first time that my credit score has dipped below XXXX. 

I wrote to Comenity and explained this to them. They wrote back and said they were unwilling to remove the negative remark on my credit report. My husband and I will be taking out a mortgage later this year, and Im so afraid that this dip will impact our interest rate. As I mentioned before, this has never happened to me. I have an otherwise spotless credit report. Im afraid that this one mistake will cost us in the interest rate were able to get on this much larger, much more important loan. 

Thanks again for your help today. Please let me know if there is any other information I can provide.",None,"Bread Financial Holdings, Inc.",MA,024XX,None,Consent provided,Web,08/09/21,Closed with explanation,Yes,N/A,4613199,59.0,-0.5,8,30,3,Collection Communication Failure,Phone,Store Credit Card,Refusal to Remove Negative Remark,Credit Score Damage|Mortgage Rate Impact,,,,Comenity Bank
a7da4c97-2dc2-47dc-9e58-4b77124e19e4,07/03/25,"Money transfer, virtual currency, or money service",Domestic (US) money transfer,Fraud or scam,None,"Our contractors email accounts where hacked and we received incorrect banking information. 

XX/XX/year> {$100000.00} was ACH transferred from Chase Bank XXXX XXXX XXXX XXXXXX/XX/year> I learned of the scam and of the wrong account and contacted Chase Bank for assistance. 
XX/XX/year> FBI IC3 Complaint was filed and Field Agent XXXX XXXX was assigned XX/XX/year> State Police FTC # XXXX was filed XX/XX/year>XXXX XXXX XXXX XXXXXXXX Police Case # XXXX was filed and XXXX XXXX has been assigned. 

XXXX. XXXX was able to issue a warrant on the XXXX XXXX account that funds where sent to and verified that some funds are still in the account and that the account is frozen. 

For over 90 days we have been getting the run around from the banks with no progress. 
XX/XX/year> I filed a complaint with the State of Massachusetts Attorney Generals office.",None,JPMORGAN CHASE & CO.,MA,015XX,None,Consent provided,Web,07/03/25,Closed with explanation,Yes,N/A,14443031,100000.0,-0.9,10,90,10,Business Email Compromise,Email,ACH,Delayed Action|Ineffective Communication,Severe Financial Loss,,,FBI|State Police,Chase Bank
e7c14b97-1b91-45a8-b782-61f7d0395a3e,01/15/25,"Money transfer, virtual currency, or money service",Domestic (US) money transfer,Other transaction problem,None,"I am writing to formally express my concerns regarding XXXX in handling of disputes, particularly in light of the recent CFPB lawsuit highlighting significant issues with the platform, despite using Zelle numerous times and reporting discrepancies, my financial institution and Zelle failed to investigate my claims adequately. They informed me that recovering lost funds was impossible and that tracking these transactions was infeasible. The CFPB finding indicated that ZELLE has not only neglected to protect consumers but has allowed repeat offenders to exploit the system, leaving users vulnerable to scams. 
The lack of accountability and transparency is unacceptable and raises serious concerns about consumers safety.",None,"Early Warning Services, LLC",MA,02124,None,Consent provided,Web,01/15/25,Closed with explanation,Yes,N/A,11517222,0.0,-0.8,6,30,2,Zelle Dispute Handling,App,Zelle,Inadequate Investigation,,,Reg E Violation,Zelle,
09751f47-3e54-4276-8472-c02c075c1e38,12/16/20,"Money transfer, virtual currency, or money service",Virtual currency,Fraud or scam,None,"Hi I have been a Coinbase user for the last 3+ years and recently I saw a transaction of {$1000.00} from my bank account to Coinbase and no description of the problem was provided in the detail section. I logged a complain about it using Coinbase 's Help center on their website. Rather than providing me a satisfactory answer instead they disabled my account. It happened on the XXXX XXXX, 2020 and I received a reply from them that we have assigned your case to an account specialist for review and we will get back to you as soon as the review is done. The review takes 3-5 business days. It's been 17 days now and I am not getting any update from them though in these 17 days I have sent them more than 20 emails but they won't respond. 
My account had roughly {$38.00}, XXXX when they locked it. Where {$22.00}, XXXX or a little more were in USD and more than {$15.00}, XXXX in different cryptos. 
I am locked out of my account and since crypto currency is so volatile that I have already lost lots of money because I can't take proper steps to sell my cryptos  in time. Also I am at a high risk of losing most of my money in the blink of an eye if any crash happens which multiple analysts are already talking about while Coinbase wouldn't resolve my issue and won't respond to any of my emails and won't even unlock my account. They have no online chat or phone no to be used for contacting in case of any such issues. 

My Case # is XXXX and my email address associated with my account is XXXX. I tried contacting them on XXXX as well but no luck there as well. Someone on XXXX then referred CFPB that they are very active and helpful in case like this. I'll really appreciate if this matter be taken with them and my case be resolved in time. 

Let me know if you have any questions. 

Regards, XXXX",None,"Coinbase, Inc.",MA,027XX,None,Consent provided,Web,12/16/20,Closed with explanation,Yes,N/A,4015645,39000.0,-0.9,9,17,20,Unauthorized Transfer / Account Freeze,Email,Cryptocurrency,Account Frozen|Lack of Response|Poor Customer Service,Investment Loss|Financial Stress,,,Coinbase,
b233af63-fc5c-4862-9a5f-3bbec861888f,08/30/24,"Money transfer, virtual currency, or money service",Mobile or digital wallet,Trouble accessing funds in your mobile or digital wallet,None,On XX/XX/year> I added {$400.00} to my venmo account in an attempt to pay rent. After sending {$200.00} to my landlord my account suddenly got frozen and I was no longer able to access the funds. I got an email shortly after stating that my ID needed to be verified with no further information about why my money was not going to be released. I emailed support twice asking for assistance and both times I was met with a representative who stated that they could do nothing about this and that I must wait XXXX days. Im now reaching out to you because I dont know how Im going to be able to pay my rent. I dont think theyre going to unfreeze my account or release my money. I need help and I dont know where to turn. I looked online and found multiple other stories of people who had similar amounts of money held by Venmo in addition to stories about even more money being held. This feels like a scam and Im afraid Ill never get my money back let alone in time to stay off the streets.,None,"Paypal Holdings, Inc",MA,02124,None,Consent provided,Web,08/30/24,Closed with explanation,Yes,N/A,9959379,400.0,-0.95,10,5,3,Account Freeze / Funds Withheld,App,Venmo,Account Frozen|Refusal to Release Funds,Rent Money|Homelessness Risk,Tenant,,Venmo,
62026a6e-cb40-41f1-9022-67b4a3b50568,04/16/22,"Money transfer, virtual currency, or money service",Virtual currency,Fraud or scam,None,"On XX/XX/2022, I made a bitcoin ( of XXXX unit ) purchase on Coinbase XXXX using the majority of my cash balance of {$20000.00} at noon. However, the transaction didn't seem to go through as the purchase wasn't shown in the portfolio balance but the cash balance dropped by the amount purchased. So I reached out to Coinbase and asked for a resolution. The technician didn't know the issue and planned to seek his colleague for help. Around XXXX I got a call from XXXX XXXX who claimed to work for Coinbase to help me with my issue. He said the transaction didn't go through due to the need for my ID verification. He then sent me an email asking for my driver 's license and then sent all my bitcoin balance of ( {$48000.00} for XXXX units of Bitcoin + XXXX cash balance ) at Coinbase XXXX to an unknown blockchain address. He then hung up the phone. I contacted Coinbase customer service and they said they can not revert the transaction and they don't have a strict regulation on bitcoin transfers to any external address. Also, they don't provide FDIC insurance of any amount either. 

I would like for CFPB to contact Coinbase to investigate the poor customer service they had in terms of providing security and protection to its customers.",None,"Coinbase, Inc.",MA,01810,None,Consent provided,Web,04/16/22,Closed with explanation,Yes,N/A,5456264,68000.0,-0.9,9,1,3,Tech Support Scam / Impersonation,Phone,Cryptocurrency,Poor Security|Denied Claim,Severe Financial Loss,,,Coinbase,
b3287b71-3f4d-4a2c-a24c-6597f0f1392c,01/15/25,"Money transfer, virtual currency, or money service",Domestic (US) money transfer,Other transaction problem,None,"I am writing to formally address my concerns about Zelles handling of disputes, particularly in light of the recent CFPB lawsuit that highlights critical shortcomings with the platform. Despite using Zelle frequently and reporting discrepancies, both my financial institution and Zelle failed to thoroughly investigate my claims. I was informed that recovering lost funds was not possible and that tracking these transactions was not feasible. The CFPBs findings reveal that Zelle has not only failed to protect consumers but has also enabled repeat offenders to exploit the system, leaving users exposed to scams.",None,"Early Warning Services, LLC",MA,01420,None,Consent provided,Web,01/15/25,Closed with explanation,Yes,N/A,11567162,0.0,-0.8,5,30,2,Zelle Dispute Handling,App,Zelle,Inadequate Investigation,,,Reg E Violation,Zelle,
d98c0561-7927-4a56-96a3-1ebc8777f43e,09/15/25,Checking or savings account,Checking account,Managing an account,Banking errors,"I was victim to a phishing scam and capital one refused my fraud claim and didnt give me a provisional refund which is required under the EFTA act. I am now out {$680.00} and neither capital one nor the merchant, XXXX  will return the funds. XXXX and XXXX both report data breeches in XXXX of this year and thats when the fraudulent transaction ( s ) were made ( XXXX of them ). I am out of work in financial crisis that was the last of my unemployment and I now face eviction utility shut off and possible sale of my vehicle to cover bills. Its not fair I eat that when they refuse to do their jobs and issue a refund. XXXX XXXX has XXXX claims against them for similar phishing scams and XXXX complaints to the XXXX and a class action lawsuit. I need that money back.",None,CAPITAL ONE FINANCIAL CORPORATION,MA,020XX,None,Consent provided,Web,09/15/25,Closed with explanation,Yes,N/A,15933461,680.0,-1.0,10,60,3,Phishing,Unknown,ACH / Checking Account,Denied Claim|No Provisional Refund,Eviction Risk|Utility Shut off|Loss of Unemployment Funds,Unemployed,Reg E Violation,,Capital One
950a231f-230d-4b26-a7a0-9d3b69d55c5b,09/25/25,"Money transfer, virtual currency, or money service",Domestic (US) money transfer,Fraud or scam,None,"What happened : On XX/XX/year>, I was contacted by someone claiming to be XXXX XXXX, saying she was associated with an inmate named XXXX XXXX. The caller told me that XXXX was in confinement and urgently needed money for hygiene products and a replacement tablet. Believing this information, I sent two payments through CashApp totaling {$270.00} : {$130.00} at XXXX XXXX {$140.00} at XXXX XXXX  Later, I confirmed directly with XXXX that she was not in confinement and had not requested any money. I reported this as fraud to CashApp and submitted a dispute ( Case # XXXX ). I also reported it to my local police department ; the incident is documented under Case # XXXX. 

I asked CashApp multiple times for a way to submit the police report and supporting documentation, but they have not provided a method to do so. The company has denied reimbursement, stating they could not confirm a scam, even though law enforcement has documented it. 

I am requesting a full review of my fraud claim and reimbursement of the {$270.00} lost.",None,"Block, Inc.",MA,02445,None,Consent provided,Web,10/03/25,Closed with explanation,Yes,N/A,16187600,270.0,-0.8,7,20,5,Family Impersonation Scam,Phone / Text,CashApp,Denied Claim|Refusal to Accept Police Report,,,,CashApp|Police Department,
1b5b5fe8-90ee-4271-bb5e-54000586a008,01/15/25,"Money transfer, virtual currency, or money service",Domestic (US) money transfer,Other transaction problem,None,"I am writing to formally express my concerns regarding Zelle 's handling of disputes, particularly in light of the recent CFPB lawsuit highlighting significant issues with the platform. Despite using Zelle numerous times and reporting discrepancies, my financial institution and Zelle failed to investigate my claims adequately. They informed me that recovering lost funds was impossible and that tracking these transactions was unfeasible. The CFPB 's findings indicate that Zelle has not only neglected to protect consumers but has also allowed repeat offenders to exploit the system, leaving users vulnerable to scams.This lack of accountability and transparency is unacceptable and raises serious concerns about consumer safety.",None,"Early Warning Services, LLC",MA,02780,None,Consent provided,Web,01/15/25,Closed with explanation,Yes,N/A,11517908,0.0,-0.8,6,30,2,Zelle Dispute Handling,App,Zelle,Inadequate Investigation,,,Reg E Violation,Zelle,
6ddc7690-d0dc-42f7-94c5-2247f323727b,07/04/25,"Money transfer, virtual currency, or money service",Domestic (US) money transfer,Fraud or scam,None,"I sent money to my friend Sunday at XXXX XXXX, the amount is XXXX $ the money went to wrong people I requested the money they never give it to me. I want the company contact the scammer get the full refund please",None,"Block, Inc.",MA,02301,None,Consent provided,Web,07/04/25,Closed with explanation,No,N/A,14447292,0.0,-0.6,6,2,1,Misdirected Payment,App,Money Transfer,Lack of Help,,,,,
749260dc-2d96-44a6-b10d-2ffec1f51b24,08/18/25,"Money transfer, virtual currency, or money service",Domestic (US) money transfer,Fraud or scam,None,"I was the victim of a scam in which I was manipulated into sending {$1200.00} through XXXX from my Ally Bank account. The person I sent the money to used false pretenses to convince me the payment was legitimate. Once I realized it was fraud, I filed a police report with the XXXX, RI Police Department ( within a day or so ) and submitted it to Ally Bank. 

Ally initially denied the dispute, stating that the transfer was authorized. I then requested a second review of the case, and was told someone from their XXXX XXXX XXXX team would reach out within XXXX business days. That deadline passed without contact. I followed up again and was told to expect a response in XXXX business days. That timeline also passed without any outreach. 

Today, I called again and was first told I needed to wait another XXXX business days. When I asked to speak with someone from the XXXX Relations team directly, I was denied. No one from that team has ever contacted me, despite multiple promises. Ive now waited weeks without any resolution, next steps, or communication from anyone in a position to help. 

I have cooperated fully, submitted all requested documentation, and followed XXXX dispute procedures in good faith. I am still left without a resolution or clear path forward.",Company has responded to the consumer and the CFPB and chooses not to provide a public response,ALLY FINANCIAL INC.,MA,027XX,None,Consent provided,Web,08/18/25,Closed with explanation,Yes,N/A,15345453,1200.0,-0.9,8,30,6,Authorized Push Payment Fraud,Unknown,Money Transfer,Denied Claim|Failure to Contact|Broken Promises,,,,Police Department,Ally Bank
