931078df-71ee-4075-9713-60ec7a7df9d5,08/20/23,"Money transfer, virtual currency, or money service",Virtual currency,Fraud or scam,None,"On Saturday, XX/XX/2023, around XXXXXXXX XXXX I found that all my SHIBA coins and ETH coin were gone/stolen without my authorization. I have no ideas how this happened. 
I have tried to reach the Trust Wallet support but they didn't reply to me. Only an AI is available.",None,"DApps Platform, Inc.",MA,02140,None,Consent provided,Web,08/20/23,Closed with explanation,No,N/A,7429193,0.0,-0.8,7,0,1,Crypto Theft,Unknown,Cryptocurrency,Inadequate Support|AI-only interaction,Asset Loss,,,Trust Wallet,
df98efcc-0f40-47e7-b1dc-0b86c1767762,12/27/21,"Money transfer, virtual currency, or money service",Domestic (US) money transfer,Fraud or scam,None,"Bank of America allowed a transaction of {$6900.00} to be transferred from my account to another "" trusted '' Bank if America customer. 
Initial transaction on XX/XX/XXXX for {$4400.00} and again on XX/XX/XXXX for {$2400.00}. 

The payments were to reserve a seasonal home rental. I have XXXX active police investigations. I have reached out to the Fraud Department of Bank of America. They returned ONLY {$1400.00} stating that was all they could get from his account as he has been "" blacklisted ''. Bank of America refuses to hear my pleas, and continues to ignore my requests for reconsideration. I would not be pressing this if the other party was not a "" trusted '' Bank of America customer like myself. It is unfair and THEY dropped the ball in their screening process. I want to seek legal action, but know it will be a difficult process. In the mean time my entire savings was wiped clean. How American.",Company has responded to the consumer and the CFPB and chooses not to provide a public response,"BANK OF AMERICA, NATIONAL ASSOCIATION",MA,010XX,None,Consent provided,Web,12/27/21,Closed with monetary relief,Yes,N/A,5045483,6900.0,-0.9,9,0,4,Rental Scam,Unknown,Bank Transfer,Denied Claim|Ignored Requests|Inadequate Screening,Savings Wiped|Rent Money,,Reg E Violation,Police,Bank of America
b3996d0a-0c22-4db1-a071-b00cf0e6bf02,01/21/25,"Money transfer, virtual currency, or money service",Domestic (US) money transfer,Other transaction problem,None,"I am writing to formally express my concerns regarding Zelle 's handling of disputes, particularly in light of the recent CFPB lawsuit highlighting significant issues with the platform. Despite using Zelle numerous times and reporting discrepancies, my financial institution and Zelle failed to investigate my claims adequately. They informed me that recovering lost funds was impossible and that tracking these transactions was unfeasible. The CFPB 's findings indicate that Zelle has not only neglected to protect consumers but has also allowed repeat offenders to exploit the system, leaving users vulnerable to scams. This lack of accountability and transparency is unacceptable and raises serious concerns about consumer safety.",None,"Early Warning Services, LLC",MA,02301,None,Consent provided,Web,01/21/25,Closed with explanation,Yes,N/A,11768525,0.0,-0.5,3,0,5,General Fraud Management,Mobile App,Zelle,Failed to investigate|Lack of accountability,,,Reg E Violation,CFPB,Zelle
3493d390-3da8-41ec-81b0-9c58f834462f,05/02/25,Checking or savings account,Checking account,Problem with a lender or other company charging your account,Transaction was not authorized,"Complaint type : Problem with a transaction or unauthorized charges Company : Chime Financial , Inc. 
What happened : I was scammed out of {$500.00} by a fraudulent website impersonating XXXX. They tricked me into entering my Chime bank details under the false pretense of verifying my account. The scammer then used my account to buy cryptocurrency. I provided Chime with documentation, screenshots, timestamps, and all the evidence clearly showing that I was deceived. 

Chime denied my dispute not once, but XXXX, with no explanation as to why, even though I provided everything they needed. I spoke with Supervisor XXXX, who acknowledged the scam but did not resolve the issue. Then, Supervisor XXXX stated that I would receive a refund after reviewing the evidence, but that never happened. I also spoke with Representative XXXX, who confirmed the scam, but the issue remained unresolved. Additionally, I spoke with Manager XXXX, who failed to offer any solution or further clarity. Manager XXXX attempted to deflect the matter by saying that she doesnt know what goes on with the investigations team even though she claims she is the manager. 

Chime has refused to give me any information as to why my dispute was denied XXXX. Despite having all the proof necessary and multiple representatives confirming this was fraud, they have failed to explain what went wrong, what they still need ( if anything ), or how Im supposed to proceed. If they needed more documentation, they never asked. Ive been left completely in the dark about whats going on with my case and why my money continues to be withheld. 

Im currently unemployed, and this {$500.00} was my rent money. Ive filed a complaint with the XXXX XXXX XXXX and am now submitting this to the CFPB. Chime has shown a complete lack of accountability and transparency in how they handle fraud claims. I am requesting a full refund and a formal investigation into how this dispute was managed.",None,Chime Financial Inc,MA,01902,None,Consent provided,Web,05/02/25,Closed with monetary relief,Yes,N/A,13307245,500.0,-0.9,10,0,6,Phishing,Website,Bank Account,Denied Claim|No explanation|Conflicting information,Rent Money|Financial Loss,Unemployed,Reg E Violation,State Attorney General,"Chime Financial, Inc."
